"Item Code","Item Name","Item Description","Item Category","Item Price","Item Weight","Item Quantity","Item Options","Item Attributes"
101,"Baby Blue 100% Cotton Button Up","Antique wash (faded blue). Spread collar; pearlized-button font. Long sleeves with button cuffs. Flap patch pockets on chest. Tencel Made in USA of imported material.rnrnAntique wash (faded blue). Spread collar; pearlized-button font. Long sleeves with button cuffs. Flap patch pockets on chest. Tencel Made in USA of imported material.",General|Shirts,5.00,1,0,Size|Small|small|0.00|1|99~~Size|Medium|medium|0.00|1|99~~Size|Large|large|2.00|1|99,
102,"Baby Blue 100% Cotton Button Up","Antique wash (faded blue). Spread collar; pearlized-button font. Long sleeves with button cuffs. Flap patch pockets on chest. Tencel Made in USA of imported material.",General|Shirts,4.99,1,0,Size|Small|small|0.00|1|99~~Size|Medium|medium|0.00|1|99~~Size|Large|large|2.00|1|99,
103,"100% Cotton Button Up","Spread collar; pearlized-button font. Long sleeves with button cuffs. Tencel Made in USA of imported material.",General|Shirts,10.00,1,0,"Color|Blue Striped|blue-striped|0.00|1|99~~Color|Light Blue|light-blue|2.00|1|99~~Size|Small|small|0.00|1|99~~Size|Medium|medium|0.00|1|99~~Collar|Large 16""|Large 16""|2.00|1|99",
104,"T Shirt 2","This is a description. This is a description. This is a description. This is a description. This is a description. This is a description. This is a description. This is a description. This is a description. This is a description. Hello. This is a description. This is a description. This is a description. Hello",General|Shirts,15.99,1.5,1,Color|Red|red|0.00|0|5~~Size|X-Large|xlarge|2.00|1|4~~Color|Green|green|0.00|1|6~~Material|Polyester|polyester|0.00|1|8~~Material|Cotton|cotton|0.00|1|7~~Size|Small|small|0.00|1|1~~Size|Medium|medium|0.00|1|2~~Size|Large|large|0.00|1|3,test|thetest~~another|test
567,"Testing T-Shirt","Super soft t shirt, muscle fitted.",General|Shirts,7.00,1,1,Size|Small|small|0.00|1|1~~Size|Medium|medium|0.00|1|2~~Size|Large|large|2.00|1|3,CustomAttributeName|CustomAttributeValue~~AnotherOne|AnotherValue
123,"Yellow T-Shirt","Yellow shirt that is comfortable",General|Shirts,8.99,1,1,Size|Small|small|0.00|1|1~~Size|Medium|medium|0.00|1|2~~Size|Large|large|2.00|1|3,
